[
  {
    "status": "current",
    "Chinese_name": "黃鈞喆",
    "English_name": "Chun-Che Huang",
    "title": "HarryHuang",
    "photo": "00.jpeg",
    "email": "harryhuang1101@gmail.com",
    "bio": [
      null
    ],
    "short_bio": "I am a Mathematics graduate from National Cheng Kung University with a strong focus on applying AI to legal text analysis. My research combines NLP, retrieval-augmented generation (RAG), and hierarchical knowledge modeling to enhance entity extraction, constitutional issue identification, and legal knowledge graph construction",
    "socials": {
      "linkedin": "",
      "github": "",
      "facebook": "",
      "instagram": ""
    },
    "id": "1"
  },
  {
    "status": "current",
    "Chinese_name": "周穆可",
    "English_name": "Mu-Ko Chou",
    "title": "Master’s student",
    "photo": "2.jpeg",
    "email": "nm6144012@gs.ncku.edu.tw",
    "bio": [
      "Class of 2027",
      "AI × Social Science",
      "LLM bias & health communication"
    ],
    "short_bio": "Mu-Ko Chou is a master's student in the Intelligent Technology Systems Program at the Miin Wu School of Computing, National Cheng Kung University (NCKU), with a background in political science. Her research focuses on AI ethics and the integration of diverse artificial intelligence technologies, particularly in: (1) legal AI applications; (2) incorporating cultural dimensions into LLMs to examine cross-cultural differences in simulated human decision-making; and (3) designing domain-specific LLM benchmarks with stakeholder participation to ensure local relevance, fairness, and practical value.",
    "socials": {
      "linkedin": "https://www.linkedin.com/in/mu-ko-chou",
      "github": "https://github.com/claire891018",
      "facebook": "",
      "instagram": ""
    },
    "id": "2"
  },
  {
    "status": "current",
    "Chinese_name": "侯欽祐",
    "English_name": "Chin-Yu Hou",
    "title": "Multidisciplinary Humanities Explorer",
    "photo": "3.jpeg",
    "email": "b34111135@gs.ncku.edu.tw",
    "bio": [
      "Class of 2028",
      "Digital Humanities × AI",
      "Exploring LLMs and retrieval methods",
      "AI applications in the humanities"
    ],
    "short_bio": "I am a senior undergraduate in History at NCKU, focusing on Digital Humanities. My interests include applying AI, especially language models and retrieval techniques, to expand research possibilities.",
    "socials": {
      "linkedin": "",
      "github": "",
      "facebook": "",
      "instagram": ""
    },
    "id": "3"
  },
  {
    "status": "current",
    "Chinese_name": "牛俊傑",
    "English_name": "Chun-Chieh Niu",
    "title": "Human being",
    "photo": "4.jpeg",
    "email": "nm6144038@gs.ncku.edu.tw",
    "bio": [
      "class of 2027",
      "Volleyball CV research",
      "Firmware & PCB design"
    ],
    "short_bio": "Chun-Chieh Niu is currently a master’s student in the Intelligent Technology Systems Program at the Miin Wu School of Computing, National Cheng Kung University (NCKU). He received his B.S. degree from the Department of Engineering Science at NCKU and now serves as the Chief Technology Officer (CTO) of TechNSport Technology. His research interests include robotics, the Internet of Things (IoT), large language models (LLMs), and sports science, with a focus on integrating AI and sensing technologies into smart sports applications and human–machine collaboration.",
    "socials": {
      "linkedin": "",
      "github": "https://github.com/CCNiu",
      "facebook": "",
      "instagram": ""
    },
    "id": "4"
  },
  {
    "status": "current",
    "Chinese_name": "陳靖則",
    "English_name": "Jing-Ze Chen",
    "title": "Jerry Jing-Ze Chen",
    "photo": "5.jpeg",
    "email": "jcicku@gmail.com",
    "bio": [
      "",
      "",
      ""
    ],
    "short_bio": "Hi, I’m Jerry. I major in Industrial & Information Management and work part-time as a quantitative research consultant. I’m deeply interested in value investing, strategic history, and visual design, and I have a knack for strategy games. I believe that developing AI for regulatory domains—finance, law, defense, and medicine—is an inevitable trend. I’m pursuing both ends of the smile curve and believe that coherent communication and collaboration can boost our sync rate and lead us toward a better future.",
    "socials": {
      "linkedin": "https://www.linkedin.com/in/jingzec",
      "github": "",
      "facebook": "",
      "instagram": ""
    },
    "id": "5"
  },
  {
    "status": "former",
    "Chinese_name": "林淑真",
    "English_name": "Amy Lin",
    "title": "Laboratory Administrative Coordinator",
    "photo": "6.jpeg",
    "email": "amylin0301@gs.ncku.edu.tw",
    "bio": [],
    "short_bio": "I hold a Master’s degree in Advertising from National Chengchi University and currently serve as an Administrative Coordinator in our laboratory, supporting the team’s research activities and project operations.",
    "socials": {
      "linkedin": "",
      "github": "",
      "facebook": "",
      "instagram": ""
    },
    "id": "6"
  },
  {
    "status": "former",
    "Chinese_name": "陳宥橋",
    "English_name": "Yu-Chiao Chen",
    "title": "Research Assistant",
    "photo": "陳宥橋.jpg",
    "email": "f74091093@gs.ncku.edu.tw",
    "bio": [
      "Have a smile!"
    ],
    "short_bio": "typing...",
    "socials": {
      "linkedin": "",
      "github": "",
      "facebook": "",
      "instagram": ""
    },
    "id": "0"
  },
  {
    "status": "current",
    "Chinese_name": "劉宇宸",
    "English_name": "YU-CHEN LIU",
    "title": "alive",
    "photo": "/members/7.jpg",
    "email": "NM6151043@gs.ncku.edu.tw",
    "bio": [],
    "short_bio": "",
    "socials": null,
    "id": "7"
  }
]
